{
  "asset_id": "PHY-REFERENCE-MECH-PROJECTILE-001",
  "family": "reference",
  "title": "拋體運動｜分量與最高點判讀卡",
  "audience": "both",
  "subject": "physics",
  "topic": "mechanics/projectile-motion",
  "learning_objectives": [
    {"id":"PHY-MECH-PROJ-LO1","statement":"能快速分解初速度。"},
    {"id":"PHY-MECH-PROJ-LO2","statement":"能快速判讀水平與垂直運動。"},
    {"id":"PHY-MECH-PROJ-LO3","statement":"能快速判讀最高點狀態。"}
  ],
  "misconception_tags": [
    "MIS-PROJ-TOP-ACCEL-ZERO",
    "MIS-PROJ-HORIZONTAL-ACCEL",
    "MIS-PROJ-COMPONENTS-DEPENDENT"
  ],
  "render": {
    "seed": 210441,
    "viewport": {"width":1440,"height":1080},
    "theme": "paper-staly-physics-dark-v1",
    "fallback_fonts": ["Noto Sans TC","PingFang TC","Microsoft JhengHei","Arial","sans-serif"]
  },
  "content": {
    "summary": "拋體運動快速查閱卡：先分解初速度，再分開處理水平與垂直方向，最高點只讓垂直速度歸零。",
    "formulae": ["v₀x = v₀ cosθ · v₀y = v₀ sinθ · aₓ = 0 · aᵧ = −g"],
    "diagram": "../../../../mechanics/assets/03_projectile-motion.svg",
    "use_note": "適合解題前檢查、複習頁與課堂公式側欄。",
    "references": [
      "忽略空氣阻力：水平方向 aₓ = 0，因此 vₓ 保持不變。",
      "垂直方向 aᵧ = −g，依等加速度運動處理。",
      "最高點：vᵧ = 0，但 vₓ 通常不為 0，且 aᵧ 仍為 −g。",
      "水平與垂直共享同一時間 t，但可分開列運動方程。"
    ]
  },
  "qa": {
    "checks": [
      {"id":"QA-SCHEMA","description":"必要欄位完整","required":true},
      {"id":"QA-FORMULA","description":"分量式與加速度方向一致","required":true},
      {"id":"QA-APEX","description":"最高點不誤寫為總速度／加速度為零","required":true},
      {"id":"QA-DETERMINISTIC","description":"固定 seed 與 viewport","required":true}
    ]
  }
}
