{
  "asset_id":"PHY-TEACH-MECH-CIRCULAR-001",
  "family":"teach",
  "title":"等速圓周運動｜速率不變，速度仍在改變",
  "audience":"student",
  "subject":"physics",
  "topic":"mechanics/uniform-circular-motion",
  "learning_objectives":[
    {"id":"PHY-MECH-CIRC-LO1","statement":"能說明等速圓周運動雖然速率不變，但速度方向持續改變，因此仍有加速度。"},
    {"id":"PHY-MECH-CIRC-LO2","statement":"能使用 a_c = v²/r 與 F_c = mv²/r 判斷向心加速度與向心淨力。"},
    {"id":"PHY-MECH-CIRC-LO3","statement":"能辨識實際作用力中哪一個或哪一些力提供指向圓心的淨力，而不把向心力視為額外的新力。"}
  ],
  "misconception_tags":["MIS-CIRC-CONSTANT-SPEED-NO-ACCEL","MIS-CIRC-CENTRIPETAL-IS-EXTRA-FORCE","MIS-CIRC-VELOCITY-POINTS-INWARD"],
  "render":{"seed":210501,"viewport":{"width":1440,"height":1080},"theme":"paper-staly-physics-dark-v1","fallback_fonts":["Noto Sans TC","PingFang TC","Microsoft JhengHei","Arial","sans-serif"]},
  "content":{
    "summary":"圓周運動中的速率可以固定，但速度向量的方向持續改變；這個方向變化對應指向圓心的向心加速度與向心淨力。",
    "formulae":["a_c = v²/r","F_c = mv²/r"],
    "diagram":"../../../../mechanics/assets/04_uniform-circular-motion.svg",
    "quick_check":[
      "等速圓周運動的『等速』為什麼不代表加速度為零？",
      "若速率變成 2 倍、半徑不變，向心加速度會變成幾倍？",
      "汽車平轉彎時，哪一種實際作用力可能提供向心淨力？"
    ]
  },
  "qa":{"checks":[
    {"id":"QA-SCHEMA","description":"必要欄位完整","required":true},
    {"id":"QA-VECTOR-LANGUAGE","description":"明確區分速率與速度向量","required":true},
    {"id":"QA-FORCE-ROLE","description":"明確說明向心力是淨力角色而非額外新力","required":true},
    {"id":"QA-DETERMINISTIC","description":"固定 seed 與 viewport","required":true}
  ]}
}
