{
  "asset_id":"PHY-DIAGNOSE-MECH-CIRCULAR-001","family":"diagnose","title":"等速圓周運動｜向心概念迷思診斷","audience":"both","subject":"physics","topic":"mechanics/uniform-circular-motion",
  "learning_objectives":[{"id":"PHY-MECH-CIRC-LO1","statement":"能說明等速圓周運動雖然速率不變，但速度方向持續改變，因此仍有加速度。"},{"id":"PHY-MECH-CIRC-LO2","statement":"能使用 a_c = v²/r 與 F_c = mv²/r 判斷向心加速度與向心淨力。"},{"id":"PHY-MECH-CIRC-LO3","statement":"能辨識實際作用力中哪一個或哪一些力提供指向圓心的淨力，而不把向心力視為額外的新力。"}],
  "misconception_tags":["MIS-CIRC-CONSTANT-SPEED-NO-ACCEL","MIS-CIRC-CENTRIPETAL-IS-EXTRA-FORCE","MIS-CIRC-VELOCITY-POINTS-INWARD"],
  "render":{"seed":210531,"viewport":{"width":1440,"height":1080},"theme":"paper-staly-physics-dark-v1","fallback_fonts":["Noto Sans TC","PingFang TC","Microsoft JhengHei","Arial","sans-serif"]},
  "content":{"summary":"用三個典型錯誤說法診斷學生是否混淆速率與速度、向心力角色，以及速度與加速度方向。","formulae":["a_c = v²/r","F_c = mv²/r"],"diagram":"../../../../mechanics/assets/04_uniform-circular-motion.svg","diagnostic_intent":"辨識學生是否因『等速』而誤判加速度為零、把向心力當作額外新力，或把速度方向畫向圓心。","cases":["學生甲說：等速圓周運動速率不變，所以加速度等於零。指出錯誤概念。","學生乙在受力圖中畫出摩擦力、重力、正向力之外，另外再畫一個『向心力』。這代表什麼迷思？","學生丙把速度箭頭畫向圓心。應如何修正速度與加速度的方向？"]},
  "qa":{"checks":[{"id":"QA-SCHEMA","description":"必要欄位完整","required":true},{"id":"QA-MISCONCEPTION-MAP","description":"三個案例對應三個 misconception tags","required":true},{"id":"QA-FORCE-ROLE","description":"不把向心力畫成額外作用力","required":true},{"id":"QA-DETERMINISTIC","description":"固定 seed 與 viewport","required":true}]}
}